<?xml version="1.0" encoding="UTF-8"?>
<audicoes xmlns:xsi="http://www.w3.org/2001/XMLSchema-instance"
 xsi:noNamespaceSchemaLocation="file:/C:/xampp/htdocs/GAMu/audicoes.xsd">
    <audicao id="id0">
        <metainfo>
            <data>data0</data>
            <hora>hora0</hora>
            <local>local0</local>
            <organizador>organizador0</organizador>
            <duracao>duracao0</duracao>
        </metainfo>
        <atuacoes>
            <atuacao>
                <hora_inicio>hora_inicio0</hora_inicio>
                <musicos>
                    <musico>
                        <nome>nome0</nome>
                        <instrumento>instrumento0</instrumento>
                    </musico>
                    <musico>
                        <nome>nome1</nome>
                        <instrumento>instrumento1</instrumento>
                    </musico>
                </musicos>
                <obras>
                    <obra>
                        <nome>nome2</nome>
                        <duracao>duracao1</duracao>
                    </obra>
                    <obra>
                        <nome>nome3</nome>
                        <duracao>duracao2</duracao>
                    </obra>
                </obras>
            </atuacao>
            <atuacao>
                <hora_inicio>hora_inicio1</hora_inicio>
                <musicos>
                    <musico>
                        <nome>nome4</nome>
                        <instrumento>instrumento2</instrumento>
                    </musico>
                    <musico>
                        <nome>nome5</nome>
                        <instrumento>instrumento3</instrumento>
                    </musico>
                </musicos>
                <obras>
                    <obra>
                        <nome>nome6</nome>
                        <duracao>duracao3</duracao>
                    </obra>
                    <obra>
                        <nome>nome7</nome>
                        <duracao>duracao4</duracao>
                    </obra>
                </obras>
            </atuacao>
        </atuacoes>
    </audicao>
</audicoes>
